{"v":1,"sv":1,"b":"Dst11Batch000001","t":[{"i":"Dst11Task0000001","n":"Daily","r":1,"x":{"f":1,"s":"2026-08-17","c":5}}],"e":[{"i":"Dst11Task0000001","y":"2026-08-18","n":"Adjusted","l":"2026-08-18T23:00","p":20,"o":null,"s":[],"m":null,"h":[],"u":null},{"i":"Dst11Task0000001","y":"2026-08-19","c":1}]}
